{"artifact_status":"test-only","bindings":{"fixture_catalog_digest":"sha256:7306429678d02f2262618275b1733318c0da36189e08de18b9ca60d2cc04fc53","package_digest":"sha256:f2bae230e1c7947f0fce7a36a239deca3fc54d3e481416982777cf700794cbab","pnpm_lock_digest":"sha256:d120b2b3d7a3e6f332fa18d747dab305c61a3939982db4cae8dffd84d45f8a54","pnpm_workspace_digest":"sha256:1f6dc28ce8680d903153a82c839d1fafabdb37484760d3f6e720620c3eb39af7","python_build_lock_digest":"sha256:71441d1217db3a9eab17eaa1b9a6d607e5ff0d06c1c104705116944290b1954a","python_dev_lock_digest":"sha256:652def6a13f8658a74d77ffcb6cc2f895cc10864968d2b28c9886430767c5f77","signing_profile_digest":"sha256:f25f5d9c07f5398bc81c929e8d0af62c63c6f1dd61bba20b2f4b999b12b31e72","standards_digest":"sha256:23f40e849828820fbb2e3f4fdc27e214b601e644c0f4ad382ff2c81d41eb8913","trust_root_digest":"sha256:f4764c935adbadaea8e1ba55f38f7a6962f7022472454b3141e9664c80fc0689","verification_profile_digest":"sha256:9e97fdd962822527813615570c85d46f3a502f657e17659c8505f15dd944a31f"},"exact_path_count":36,"files":[{"digest":"sha256:6bedf972802be33eb3e8f97c3d2141d88e7b51e088fc90c2f777f51c3c14be52","path":".github/workflows/assurance-schema.yml","role":"workflow"},{"digest":"sha256:d2d365fe8b79df0e1cba07dd5892be0a0230c085e24e0adf0ee60f72020f8c71","path":"config/public-release-signing-standards.v0.1.json","role":"standards-authority"},{"digest":"sha256:f2bae230e1c7947f0fce7a36a239deca3fc54d3e481416982777cf700794cbab","path":"package.json","role":"dependency-lock"},{"digest":"sha256:d120b2b3d7a3e6f332fa18d747dab305c61a3939982db4cae8dffd84d45f8a54","path":"pnpm-lock.yaml","role":"dependency-lock"},{"digest":"sha256:1f6dc28ce8680d903153a82c839d1fafabdb37484760d3f6e720620c3eb39af7","path":"pnpm-workspace.yaml","role":"dependency-lock"},{"digest":"sha256:093a6cf34ad79c2d88687f9dc8ea80812d8eec25fd52d75c0c8d83980201ccc8","path":"profiles/public-release-signing.v0.1.json","role":"profile"},{"digest":"sha256:f5954c45cecdd180c003510fc7b843550fe38da400784199091afa468a1c60a5","path":"profiles/public-release-verification.v0.1.json","role":"profile"},{"digest":"sha256:71441d1217db3a9eab17eaa1b9a6d607e5ff0d06c1c104705116944290b1954a","path":"requirements-build.txt","role":"dependency-lock"},{"digest":"sha256:652def6a13f8658a74d77ffcb6cc2f895cc10864968d2b28c9886430767c5f77","path":"requirements-dev.txt","role":"dependency-lock"},{"digest":"sha256:a8ba8e1de75f7cc0a99d014181f6185e245559de92a8001537862fe1ac32b45b","path":"schema/public-release-bundle-manifest.v0.1.schema.json","role":"schema"},{"digest":"sha256:a024e8360df9304dbecc338d6b5265e22380869df57524c32f7ea036762ca8bd","path":"schema/public-release-dsse-envelope.v0.1.schema.json","role":"schema"},{"digest":"sha256:4eb560414c5b1f9e21654e6e01c9d4e3a134750f3156bfb0591616f4f0f469fc","path":"schema/public-release-fixture-catalog.v0.1.schema.json","role":"schema"},{"digest":"sha256:8c84b69d0399f7f2b658d04e27f660bc9384733f5835f14c60a552cd08ddc2aa","path":"schema/public-release-output-set.v0.1.schema.json","role":"schema"},{"digest":"sha256:1cc370eccd27fcd5b511f88a21b3d64b2fc78c85567b19ead27bd992e051bd75","path":"schema/public-release-signing-profile.v0.1.schema.json","role":"schema"},{"digest":"sha256:2518b1b7c19a89b1b73e6041cd19f4d7470d4725a0f9ce565997b31d3dc252d6","path":"schema/public-release-signing-standards.v0.1.schema.json","role":"schema"},{"digest":"sha256:ce4730b3bc7ed58045d52d18710b3942f12e6a9339a43d3313aa8048cb277e0a","path":"schema/public-release-status-entry.v0.1.schema.json","role":"schema"},{"digest":"sha256:48703ae289f76869f6c5d91f223fd4f68706fb160e0f7a993e8b3d374e7188ed","path":"schema/public-release-status-set.v0.1.schema.json","role":"schema"},{"digest":"sha256:525f488d9180aefd525b99aa990e8cf54547bd153e851bfa8572a985b1688a15","path":"schema/public-release-trust-root.v0.1.schema.json","role":"schema"},{"digest":"sha256:b0a1f8a7b2a291c3016199b653f62ae61a79faac3c4af68cbb2bca671541696e","path":"schema/public-release-verification-profile.v0.1.schema.json","role":"schema"},{"digest":"sha256:c591cb4b6bb3629f8909236ca3dfc2b29491c02076108f1253d8a5c0874efb4d","path":"schema/public-release-verification-result.v0.1.schema.json","role":"schema"},{"digest":"sha256:5dcc509fd93542cbdfce3dd378d8e9d83e4a616ffd4cf25095c5cb9cd70435c0","path":"schema/public-release-verifier-implementation.v0.1.schema.json","role":"schema"},{"digest":"sha256:ff7c3a68fcb4ee4fca7a5be04673c91dd9dfe9d2d43be5a5d8ceedeaa60faf92","path":"scripts/ae_assurance_common.py","role":"source"},{"digest":"sha256:24af2fadad7348a2ab49dcb058976849cf8c8235db2f2af290deb4f87829477e","path":"scripts/canonical_json.py","role":"source"},{"digest":"sha256:c20282f419f380e00c20c031d041de23d1c2da63cc1b71fd995313dcbcbf151f","path":"scripts/generate_public_release_fixture.py","role":"source"},{"digest":"sha256:8d7e7a7c620c787aab06b881ca135a82bfc8fc60b8a21ba5a90d55d02de1fb94","path":"scripts/public_release.py","role":"source"},{"digest":"sha256:91fabde83798a715c3fb4cf945499d6e03410620ccc7e5839e64adc7ce5be51c","path":"scripts/public_release_crypto.mjs","role":"source"},{"digest":"sha256:d3d8f6152113bad9e0b91f5ee2fee0930778b53918914af3ee93389e3805598e","path":"scripts/public_release_implementation.py","role":"source"},{"digest":"sha256:76be0fa33ef43e732a1200240b1721863f9dd587cf06e6221725d35ab59cd270","path":"scripts/sign_public_release_fixture.py","role":"source"},{"digest":"sha256:02387a68220acad52141996eb2bf55961165e5c428ed332a46b215374b2a194a","path":"scripts/validate_public_release.py","role":"source"},{"digest":"sha256:4961a495d4bcd353bc6d82c86884579af9068611aa1f6b5dc0d757dc98f217c4","path":"scripts/verify_public_release_bundle.py","role":"source"},{"digest":"sha256:aac281321cbfd2ebde659f51dfc9cb65eb6d2600af6d2632dff7244736e2adf9","path":"tests/fixtures/public-release/fixture-catalog.v0.1.json","role":"fixture-or-test"},{"digest":"sha256:8a5b1f47fb885cae706dd535fa630977837202a06fe96a88d60b8dd1e6e9375a","path":"tests/fixtures/public-release/keys/README.md","role":"fixture-or-test"},{"digest":"sha256:7f2d9ed0b71b8e5a6c5cf30e647d6e20b5bca6dac8071f11abe3fef8014db610","path":"tests/fixtures/public-release/keys/release-public.pem","role":"fixture-or-test"},{"digest":"sha256:bf019c455f05e75ce74ca02a55a4b88bab561f85a76555d8281a79f7c2985233","path":"tests/fixtures/public-release/keys/status-public.pem","role":"fixture-or-test"},{"digest":"sha256:4940f815df4fd3e1f220b43b58c732c06500aafe82e5955faabbd0174c119a30","path":"tests/fixtures/public-release/trust/fixture-trust-root.v0.1.json","role":"fixture-or-test"},{"digest":"sha256:d2aad2907530ff2cfb7cd315e5b3cdf15f13ee3caadb24696a933d5a6036e71f","path":"tests/test_public_release.py","role":"fixture-or-test"}],"implementation_digest":"sha256:4f8c392a15dc0b594c4da2f201905b719e81d46098255d1c878084522385b9ba","implementation_id":"private-match-public-release-verifier","implementation_version":"0.1","runtimes":{"node":"22.22.2","pnpm":"10.34.5","python":"3.12"},"schema_version":"0.1"}